Date,Title,Article_Link,Article
13.1.2019,Helsinki police detain three on suspicion of child sex offences,https://yle.fi/uutiset/10594230,"Helsinki police said Sunday that they had held three men on Saturday evening on suspicion of aggravated child sexual abuse and aggravated rape. However they did not specify whether or not both of the offences applied to all of the suspects, who reportedly have foreign backgrounds. Officials said they are investigating a series of offences they believe took place during the past two months at an eastern Helsinki residence, however they declined to disclose the number of alleged victims as well as their ages. Finnish news agency STT previously reported that the men were held in Helsinki’s Roihuvuori district, however police did not confirm this information to Yle but said that the operation took place in eastern Helsinki. On Saturday night STT said that police raided a home in Roihuvuori and that officials at the time said that the operation related to a previous investigation. The police raid was first reported by tabloid Ilta-Sanomat. Police said that they would not provide any further updates on the case at this stage. Police in Oulu are investigating several cases of suspected child sexual abuse, the first of which came to light late last year. No charges have yet been laid in those cases. Since the investigations came to light there have been repeated calls for dual nationals convicted of serious crimes to be stripped of Finnish citizenship. On Saturday President Sauli Niinistö said that it is ""unacceptable"" that more cases of suspected child sexual abuse had been uncovered in Oulu. ""It is unacceptable that some people who have asked for and even received asylum from us have brought evil here and created [a sense of] insecurity here,"" the President said in a statement. He added that the right to personal integrity is among the values on which Finnish society is based and with which everyone should comply. ""As I said in connection with the previous suspects, the actions in Oulu have shocked us because of their inhumanity. This was compounded by the fact that they targeted children,"" he added. However Niinistö noted that migrants should be given a chance to settle in Finland. ""Even in the most sensitive matters we need an open and pragmatic discussion and should weigh decisions carefully. Problems must be addressed and solved. That is the right of all those people who want to adjust to our society, regardless of their background."" Edit: Updated at 11.31am to include comments by President Sauli Niinistö."
13.2.2019,Yet another suspected sexual abuse case in Oulu,https://yle.fi/uutiset/10644762,"Police in the northern Finnish city of Oulu said on Wednesday that they have uncovered yet another suspected sex crime against a minor. The case is being investigated as suspected aggravated rape and aggravated sexual abuse of a child. Police believe that the crime took place in a private flat in January, and that the victim was a 14-year-old girl. Police say the latest case came to light while they were investigating two other sex crimes believed to have occurred last weekend. That case, which was reported on Tuesday, centres on the suspected rape of two girls in an Oulu apartment.  One victim is described as being under age 16 and the other as under 18. Authorities say the victims knew each other. Police told Yle that social media did not play a role in these two cases, unlike other similar cases in the city in recent months.  Oulu District Court has remanded a man described as being ""of foreign background"" in pre-trial detention in connection with the crimes. Authorities say he may face charges including aggravated rape, aggravated sexual abuse of a child, assault and coercion.  According to Detective Superintendent Markus Kiiskinen, both investigations are in their early stages.  Since December, officials in Oulu have been probing about 10 cases in which men ""of foreign background"" are suspected of sex crimes against minors. In many of the cases, victims say they were approached via social media. Also on Wednesday, the district prosecutor charged a 22-year-old man ""of foreign background"" with aggravated rape and aggravated sexual abuse of a child. The assault against a 14-year-old girl is alleged to have occurred outdoors in the Tuira neighbourhood in the northern part of Oulu on 17 November. Another sex crime against a minor is believed to occurred on the same date in the same district. "
3.9.2019,"Tuesday's papers: Child grooming, Kela benefits delays and rain moves in",https://yle.fi/uutiset/10951873,"So far this year, residents have reported some 1,500 sexual offences against minors to the police, writes national daily Helsingin Sanomat. A quarter of the reported incidents are in the capital city region. The paper asks how it’s possible that some perpetrators are able to sexually abuse multiple young victims over long periods of time without being caught. Kirsi Porras, who has worked with sexually abused kids for 15 years at the Family Federation of Finland, told HS that abusers are master manipulators who are able to make victims feel special. Many also use secret-keeping as a way of keeping children quiet about abuse, particularly when the abuser plies underage victims with alcohol and drugs. Because of easy exposure to explicit content online, experts told HS that parents need to have frank discussions with their children about what's appropriate on social media when they get their own devices--if not before. Leena Salovartio at the Prosecutor General's Office meanwhile pointed to a lack of resources when it comes to crimes against children. ""Everyone has a heart when it comes to these matters but that doesn't translate into funding or more personnel,"" she said. Several news outlets, including online magazine Uusi Suomi, report on social insurer Kela's announcement of possible delays to benefits processing due to the postal worker strike. Kela pointed out that unemployment and income support benefits may be delayed, especially if claimants have sent in documents via mail. The strike that began on Sunday evening to protest pay cuts ends at midnight on Wednesday. Finland has basked in a sunny and summer-like start to September, but according to Ilta-Sanomat, many parts of the country will see rain in the coming days. Daytime highs around the country will still remain in a mild 15-20 degree Celsius range. With warm weather continuing into early September, this summer has brought more hot--or above 25-degree-weather--days than usual to most of the country, according to the the Finnish Meteorological Institute (FMI)."
11.1.2019,Oulu police probe four new cases of suspected under-age sex abuse,https://yle.fi/uutiset/10593090,"Police in Oulu said Friday that they have launched a preliminary investigation into four fresh cases of suspected sexual abuse of girls under the age of 15. The department added that four foreign background suspects have been held in connection with the case. The announcement follows a previous round of investigations last November in which eight immigrant-background men were detained on suspicion of committing five similar offences against underage girls. Police say that the suspected offences under consideration are currently rape, aggravated child sexual abuse and child sexual abuse. In a release issued on Friday, police said that the alleged offences took place during summer 2018. Law enforcement have held three foreign-background individuals in connection with the crimes. Police suspect four people of the alleged offences, two of whom are about 20 and two are minors. Police confirmed the death of one victim last year and said that no foul play was involved. However they declined any further comment on that matter, citing an ongoing investigation into the cause of death. Police said that they will continue the probe into the new reports as well as the five cases previously reported in November. So far no charges have been laid in relation to the suspected offences committed in November. Edit: Updated at 12.01am on 12 January to clarify that two of the suspects involved in the latest cases are adult men while the other two are minors."
20.12.2005,Drive To Block Online Child Porn,https://yle.fi/uutiset/5221410,"Transport and Communications Minister Susanna Huovinen says operators have expressed interest in voluntarily placing filters to prevent access to Internet sites featuring child porn. Huovinen says that blocking access would be quite legal. A task force set up by the Ministry has examined whether police have the right to give operators lists of suspected child porn sites. Operators have not wanted to determine themselves which sites would be banned. For example, Swedish and Danish Internet operators have installed filters. In Sweden, filters were installed in May and currently block up to 30,000 attempts to access child porn sites daily. In Finland, the Transport and Communications Ministry says that within a couple of months it will be taking the first concrete steps to encourage operators to block access to child porn sites. It still needs to look at how much filters would cost operators and what would be the best way technically to block access. The possession or distribution of child pornography is against the law in Finland. Just looking at such pictures on the internet is not illegal however"
18.12.2018,German police release suspect in Oulu underage sex abuse case after communication glitch,https://yle.fi/uutiset/10560310,"A 25-year-old man suspected of the sexual abuse of a girl under the age of 15 in Oulu, northwestern Finland, who was arrested in Germany last Tuesday is now reported to be at large. According to law enforcement officials in Oulu, the suspect was released by German police before he could be transferred to Finnish custody due to ""a breakdown in communication between authorities"".  Oulu District Court ordered the suspect to be reprimanded into custody in absentia on suspicion of aggravated sexual abuse of a minor and aggravated rape. Police have issued an international warrant for the man's arrest. Local police in Oulu are investigating five separate cases of sexual offences in which all of the suspected victims were minors.  Police previously announced one major investigation involving eight suspects all of whom came to Finland as quota refugees or asylum seekers. The suspect released by German police is one of eight men being investigated."
15.8.2019,"Thursday's papers: Unread crime reports, slot machines in hospitals, the sun returns",https://yle.fi/uutiset/10923217,"Finland's biggest selling daily Helsingin Sanomat carries a report on how police may have left up to 2,000 tip-offs about suspected sexual crimes against children unopened in an ""email inbox somewhere"".  According to HS, Finnish police were slow to react when people began reporting allegations or suspicions of online sex crimes against children a number of years ago, and did not allocate enough resources to properly deal with the sudden influx of reports. ""What happened in Finland was that when these things started to grow on the web a few years ago, those tips and messages were left somewhere in an email inbox. And we only had two people in the department who ever opened them,"" commissioner Sari Sarani of the police's cybercrimes unit told HS.  However, according to Sarani, the police's practices for recording warnings about the targeting of children online have now changed, with more staff than ever currently handling the reports and investigating of such cases.  Sarani also told HS that the police seek the public's assistance in tackling sexual crimes against children.  Tabloid Iltalehti reports on the decision by Finland's gaming monopoly Veikkaus to ""quietly"" remove eight slot machines from sites which may have been deemed inappropriate.  The gambling firm has been under considerable pressure recently to review the location of some of its machines, as a citizens' initiative calling for their removal from shops and kiosks has now garnered more than 25,000 signatures. According to IL, some of the vending machines which have now been removed were located in shops or cafes connected to hospitals and rehabilitation centres. The tabloid, in a previous report, had raised concerns that certain medications may contribute to gambling addiction.  Marko Peltokorpi, director of sales at Veikkaus, told IL that the firm is reviewing the practice of placing slot machines near hospitals, health clinics and rehabilitation centres.  ""Veikkaus' point of sale criteria state that slot machines should not be placed in premises where the clientele consists mainly of minors,"" Peltokorpi told the tabloid. ""This paragraph has now been interpreted as also extending to locations whose main clientele consists of the sick and elderly.""  HS's sister tabloid Ilta-Sanomat reports that the recent unsettled weather is expected to take a turn for the better, as a high pressure system will bring the sun back to Finland this weekend.  ""The eastern part of the country will be largely clear and sunny on Saturday,"" Iiris Viljamaa, a meteorologist at the Finnish Meteorological Institute tells IS. ""Temperatures should rise to at least 23-24 degrees Celsius.""  Central and southern areas can also expect similar conditions, according to Viljamaa, and she advises people to make the most of the mellow conditions while they last.  Immediately after the weekend, the wind, rain and unstable weather will return to Finland.  Therefore, the tabloid advises, this weekend is an ideal time to start picking mushrooms and berries in the rain-soaked forest, or even just to get outside and enjoy the sunshine, as it may be the last opportunity to do so this summer. "
9.6.2020,Jyväskylä man suspected of sexual abuse of 22 kids,https://yle.fi/uutiset/11391772,"The National Bureau of Investigation announced Tuesday that it had wrapped up a preliminary investigation into a series of child sex abuse cases involving 22 victims.  The NBI said in a statement on Tuesday that it had remanded a 41-year-old Jyväskylä resident into custody in connection with the case. Investigators said that the offences involved the use of social media but did not name the platforms the man used. The suspected offences allegedly occurred between 2018 and 2020. Police said that back in 2018, they received several leads about the suspected sexual abuse and began investigating the case in autumn 2019. In October police detained the man as the main suspect in the case. He was released in December and taken into custody once more in mid-April. ""No physical intercourse was suspected in the offences, nor are other persons under suspicion. The case involves the so-called 'grooming' phenomenon, which means approaching children online with sexual intentions,"" lead investigator Sanna Springare said in the statement. The NBI said that investigators cooperated with local police in Jyväskylä and that the case has now been referred to prosecutors in western Finland for consideration of charges."
22.9.2017,"Friday's papers: Child sex abuse, car free day and a two-time lottery winner",https://yle.fi/uutiset/9845528,"Helsingin Sanomat reports on a concerning issue it says hasn't been studied, but is familiar to every professional working with adolescents in Finland today: An uptick in people seeking to pay underage children to have sex. ""Young people are constantly being confronted with offers to buy sex,"" Anna Nuotio of the Exit NGO tells the paper. Exit is an organisation working to prevent the sexual abuse of young people. She says the problem has been a hot topic among teen help groups recently. Nuotio added that the issue should be discussed in terms of child sexual abuse, rather than prostitution. Kirsi Porras of the family welfare advocacy organisation Väestöliitto says their group is also aware of the issue, adding that it includes children as young as 12 or 13. Helsinki Police detective Teija Koskenmäki-Karaharju says online offers to buy sex are being made to children 10 and up. Child protection services have also been tipped off about human trafficking rings bringing underage children into Finland for forced prostitution. Sanna Teiro, head of the Helsinki child protection services' social services, tells HS that something like this was ""unheard of in Finland five years ago."" Most of the attempts to buy sex from underage children occur over the internet, but there are also attempts on the street – anywhere where young people gather in groups. Helsinki Police detective Jari Koski tells the paper that security guards often inform the police about adults that approach the children. Just like young people that hang out regularly in Helsinki know who they can contact if they want to buy drugs, someone in their network of acquaintances is likely to know who is willing to exchange money or alcohol for sex. The age of consent in Finland is 16, but attempts to buy sex from people under 18 are considered a crime under Finnish law. Most of the incidents under investigation by the police have taken place online, and have been uncovered by the police's own criminal investigation unit. ""We discover several cases a week when an active investigation is underway,"" Koskenmäki-Karaharju tells the paper. The tabloid Ilta-Sanomat reminds its readers that this Friday is World Car Free Day, when people are encouraged to leave their car at home for the day and use another form of transport. In Finland the day will be celebrated with various events throughout the country. In Helsinki, the HSL public transport company is offering tickets at a discount, while in Tampere, people can earn a free transit ticket for the day by reporting to the Koskikeskus square and participating in a bit of exercise. Car Free Day marks the end of European Mobility Week, which began on September 16. And Ilta-Sanomat's main competitor, the tabloid Iltalehti contains a story on an against-all-odds two-time lottery winner from Joensuu. The man, who wishes to remain anonymous, has won millions of euros twice in Finnish lotteries, once in the popular weekly Lotto game and again in the add-on game of Jokeri. The first time he won was two years ago, but his second stroke of good luck took place on Wednesday, when his Jokeri line of correct numbers won him the two million-euro jackpot. Finland's gambling monopoly Veikkaus' communications representative Pipsa Öhman tells IL that this is the first time in the company's 77-year history that something like this has happened. The lucky man sat for an interview with Veikkaus when he visited their office to collect his winnings. The press was not allowed to ask the man questions, as he wanted to protect his identity. ""I had the feeling after my first win that I might win again someday,"" he told the gaming operator. IL reports that the multi-millionaire still works two jobs. He told Veikkaus that after this latest win, he might take a half-year off. ""I enjoy my work and it gets people off my back about my wins,"" he explained. The business owner used his first winnings to pay off his debt, invest in his company and buy shares. He says he might use his new jackpot to build a new home. Veikkaus merged with the slot-machine association RAY and Fintoto, the betting company specialising in trotting competitions, at the beginning of the year, raising many concerns about the company's rising monopoly in Finland. Due to its dominant position in the Finnish market, the payout percentages are somewhat lower than many international gaming groups, IL says. "
23.11.2017,"Thursday's papers: Rising anti-psychotic drug use by kids, uproar over child sex abuse verdict, rebranding Finland's famous baby box",https://yle.fi/uutiset/9944202,"Largest circulation daily Helsingin Sanomat’s city pages lead with a look at the growing use of antidepressant and anti-psychotic medication among young teens in Finland. The paper writes that these powerful drugs are being used to treat neuropsychological behavioural disorders such as depression and anxiety and that the number of children and teens being referred to psychiatric and specialty care is also on the rise. HS profiles the case of a 10-year-old girl who was exposed to a traumatic incident during an overseas trip when the family’s residence was burgled while she slept. According to the child’s mother, the trauma left the child in a state of fear and induced difficulty sleeping. The girl, now 13, was then subjected to bullying at school when she became withdrawn. The mother described how her daughter was immediately prescribed with anti-psychotic medication, quetiapine and risperidone, because of a 12-month waiting list to see a psychotherapist. According to the mother, denying the medication would have resulted in care officials notifying child welfare authorities. Leena Repokaari, head of paediatric psychiatry at the Helsinki University Hospital Hyks, said that what happened is not normal procedure. ""Patients are treated on the basis of an understanding with them and their parents and denying medication alone cannot be grounds for a child welfare complaint."" According to HS, over the past 10 years, the use of medication used to treat Attention Deficit Hyperactivity Disorder (ADHD) has surged in the Helsinki region as well as the entire country. Patients usually begin treatment between the ages of 7 and 10 and more boys than girls are prescribed the drugs. Medical professionals are also prescribing anti-psychotic and antidepressant medication to children and young adults more often. As children, more boys than girls receive anti-psychotic prescriptions, but usage of the drug increases significantly among both groups after the age of 13. Anti-psychotics are usually not recommended for these groups and many medications warn against their use in under 18-year-olds. Meanwhile tabloid daily Iltalehti looks at another issue affecting children. The paper’s online edition picks up the case of a 23-year-old asylum seeker man who was freed of rape charges for sexually assaulting a 10-year-old girl. A Pirkanmaa court did slap the accused with a three-year prison sentence for sexual abuse of the child which took place back in 2016, and an appeal court upheld the sentence. The case generated outrage when the lower court ruled that there was insufficient evidence that the child resisted the man’s advances. Meanwhile the appeal court also found that the victim was not powerless in the situation, and defined powerless as resulting from illness, a disability or a narcotic substance. IL writes that Criminal and Procedural Law Professor Matti Tolvanen challenged the courts' rulings, saying that the law does not consider the victim’s age and stage of development in evaluating powerlessness. Tolvanen noted that current laws define 16 as the age below which the rape of an under-18-year old is considered an aggravated offence, but does not consider the child’s age and level of development in determining how far the victim is capable of resisting sexual violence. He also referenced research showing that children aged 6 – 8 do not yet understand the nature of a sexual act. According to IL, as far as current legislation is concerned, a rape verdict requires violence or the threat of violence and this also applies to offences involving children. The paper notes that cases of sexual violence targeting children rarely result in a rape conviction, but mostly meet the criteria for sexual abuse or aggravated sexual abuse. Families are also in focus in the online edition of another tabloid, Ilta-Sanomat on Thursday. The paper runs a report on a spirited online discussion on the merits – and demerits – of a proposal by the national benefits agency Kela to change the name of Finland’s celebrated baby box. On Tuesday, the organisation invited suggestions from members of the public for the new moniker. In soliciting proposals, it posed the question, ""Does the name of the maternity kit discriminate against dads?"", although it stressed that it was not necessarily aiming for gender-neutrality, rather a more inclusive title. IS provided a summary of reader submissions and opinions on the issue, with the majority of comments dismissing the campaign as a waste of time and calling on the organisation to focus on more important matters. Others thought that perhaps it was time for a change, with many proposing ""baby kit"" or ""family pack"" as likely candidates. Inevitably some readers had a lighter take on the ideas put forward. ""If we want equality, in addition to dad kit, we should add 'accident kit' for those [babies] that arrive by accident,"" quipped one witty reader. ""How about the 'consequences of sex kit',"" came another rejoinder. ""Let’s put 'mustard machine kit' so Kela won’t have to continue with this,"" came one scatological comment. One deep thinker however, was of the view that the name ""family pack"" wouldn’t necessarily be an appropriate label. ""What do you mean 'family kit': Not all [expectant] mothers even have a family before the baby is born."""
