Date,Title,Article_Link,Article
12.11.2007,Crackdown on Access to Child Porn Sites,http://yle.fi/uutiset/5808898,"According to the newspaper Savon Sanomat, operators are bringing their own filters on-line that deny access to such sites. Although this would not entirely prevent the uploading of illegal material, it would make access to child pornography sites much more difficult. A law allowing measures to prevent the access and censorship of such sites came into force at the beginning of this year. Co-operation between police and service providers has been commonplace in other Nordic countries for several years. Finnish service providers received their first lists from the police about two weeks ago. 
YLE
"
26.2.2006,Most Child Porn Leads Go Nowhere,http://yle.fi/uutiset/5223191,"The Finnish National Bureau of Investigation has received about 3,000 tips concerning internet child pornography in the past three years. The majority of the tips direct investigators abroad. While almost all tips concerning Finns have been resolved, catching criminals abroad is more difficult. Faltering international collaboration means that the majority of those posting internet child pornography sites abroad never get caught. Most of the tips originate from an internet tip line run by the Save the Children organisation. The organisation passes on the tips to local officials if it can determine where the site is based. Otherwise the tip gets sent to the National Bureau of Investigation. Most of the tips direct investigators to sites based in Russia, the Ukraine and Belarus. Detective Sergeant Jukka Mäkynen of the IT-Crime Squad at the National Bureau of Investigation says it is difficult to get in contact with officials in these countries. The situation is further complicated because internet crimes have lower priority compared to other crimes in the Ukraine and Belarus. According to Minister of Transport and Communications Susanna Huovinen, Finnish operators will begin using software to prohibit access to foreign child porn sites this spring. The programs prohibit the average internet user from accessing child porn sites by accident. However, not all transmissions can be blocked. Owning and sharing child porn is a crime in Finland. However, viewing it is still legal. 
YLE24
"
4.12.2007,Illegal Pornography on the Rise,http://yle.fi/uutiset/5811712,"The Finnish Board of Film Classification and police teamed up to conduct raids on sites suspected of selling illegal pornography. Around 800 illegal movies were seized. In at least one case, a Finnish pornography producer and distributor will be taken to court for the aggravated assault allegedly portrayed in the movie. Leena Karjalainen, an inspector with the Board of Film Classification, is worried not only of the increasing brutality of pornography, but that it is becoming more commonplace in flea markets, for example, where children might be exposed to it. ""At the beginning of next year we intend to hand out guidelines for flea markets explaining what is legal, what isn't, and what vendors should do. I am going to recommend that flea markets do not sell pornography at all,"" says Karjalainen. Violent Games Also Under Scrutiny The Board will also start conducting spot tests this Christmas season on shops that sell video games with a minimum age limit of 18. Young buyers will attempt to buy the games at various shops in order to reveal vendors with lax supervision."
2.12.2005,Man Sentenced in Massive Pedophilia Case,http://yle.fi/uutiset/5220902,"The 43-year-old from Kuusankoski was seized in Helsinki in January. He was returning from his 26th trip to Thailand. The victims were boys between the ages of 12 and 13. All of the crimes, except for one, occurred in Thailand. Police had seized hundreds of video recordings, photo albums and disks as evidence. The Kouvola District Court, which handed down the sentence, says this was the biggest pedophile case in Finnish history. The man did not have a previous criminal record. YLE24, Finnish News Agency"
20.2.2008,Committee Set up to Protect Children from Internet,http://yle.fi/uutiset/5823692,"According to Lindén, society needs to ensure that the internet is as safe as possible for children. She said she's surprised by the tone of recent discussions in Finland on child pornography and freedom speech. ""We are talking about a serious crime. This material should be regulated just as strictly as printed material, for example,"" she said. Recently the National Bureau of Investigation shutdown a Finnish website that provided functioning links to child porn sites. The people behind the blocked site said they strongly oppose preventive censorship. Kirsi Miettinen of the Ministry of Transport and Communications will serve as chair of the 35-member committee. The committee will operate until the end of 2010. 
YLE
"
13.6.2005,Rooting Out Child Pornography,http://yle.fi/uutiset/5217067,The newspaper Keskisuomalainen reports that little can be done to crack down on child pornography sites that are on servers beyond Finland's borders. Now the focus is on preventing Internet users in Finland from gaining access to such sites. Justice Minister Johannes Koskinen says the government is also considering how to oblige telecoms service providers to seek and remove paedophile material from the Internet. Koskinen says that in Norway and Sweden operators have taken the initiative to clamp down on child pornography themselves. A working group is due to present its recommendations on eradicating online child porn by the end of August.
2.1.2006,Child Pornography on Finnish Internet Servers,http://yle.fi/uutiset/5221668,"Helsingin Sanomat journalists kept watch over the Sonera usenet server for two weeks, and found that hundreds of child sex pictures were being distributed there. Experts said that the same material is available on servers of nearly all internet operators. Possession and distribution of child pornography is a crime in Finland. However, operators are not in violation of the law if they do not know what material is being distributed on their servers."
30.10.2009,Finland Considers Sex Offender Registry,http://yle.fi/uutiset/5909091,"In the United States, convicted pedophiles’ names are published on the internet. “It is worth considering. The working group is certainly discussing this issue and whether it would be legally possible in Finland,” Janne Kanerva of the Justice Ministry told Aamulehti. Strict laws about privacy could, however, prevent the creation of such a registry in Finland. The working group is also considering whether or not Finnish legislation corresponds to the Council of Europe’s declaration on preventing child sexual exploitation."
16.5.2006,Tougher Action Against Online Child Porn,http://yle.fi/uutiset/5225440,"Authorities in Finland are now preparing a law which will allow the police provide telecommunications companies with the web addresses of child porn sites. Operators will then be able to add these to filtering software to prevent access by clients. Once the law is in place, police will constantly update the lists, as illegal sites tend to change addresses very quickly. They say this will not require a lot of resources as it will be carried out by pooling information with authorities worldwide. Service providers say that there is no question whatsoever that they are willing to cooperate in blocking access to child porn. But, the industry also says that is as far as it will go. Service providers are adamant about not blocking any other types of sites, saying that would be a step on a slippery slope towards a censored society."
16.6.2009,Joint Police Raid Busts Child Porn Distributors,http://yle.fi/uutiset/5269089,"In the joint operation, police seized computers and other equipment believed to contain photos and films of sexual assaults against children. In Finland, police targeted 23 homes in 14 municipalities. “The raids were made across Finland. Police detained suspects and seized computers in small towns as well as in the capital city region,” says Mika Ihaksinen of Finland's National Bureau of Investigation. Ihaksinen says the suspects were all members of the same file-sharing site. That said, police say there is no evidence to indicate that the suspects were involved in an organised child porn ring. Police, however, say the suspects were well aware of the nature of the material they were accessing, as downloading times sometimes spanned several days. Police agencies in the four countries have been gathering evidence since May against people suspected of downloading and distributing illegal child pornography through file-sharing sites. Danish authorities have led the investigation. Authorities are now tracing the source of the pornographic material, which they say may be linked to human trafficking. The exact number of arrests in the crackdown dubbed ""Operation Viking"" is not known."
21.2.2008,Child Porn Blacklist Sparks Free Speech Debate,http://yle.fi/uutiset/5823722,"For the past year, the National Bureau of Investigation has been trying to clamp down on child pornography websites by searching through suspicious URLs. ""We go through all the sites that we get from foreign police, organisations and private citizens,"" says NBI commissioner Lars Henriksson. ""We go through each website that we're presented with, and if it contains illegal material then it ends up on the blacklist."" Once a webpage is blacklisted, those trying to reach the site are directed to a police filter site instead of the one they were aiming for. The project hinges on the voluntary participation of network providers, who agree to put the filters in place. Network provider Sonera, for example, plans to join the effort in March. 
Free Speech Advocates Cry Foul
 This is the first time that movement on the internet is being restricted in Finland. It's sparked an outcry from free speech advocates, who say the blacklist is ineffective and even blocks access to perfectly innocent sites. ""Most child porn circulates on secret networks that don't show up the list at all,"" says the chairman of the civil rights organisation Electric Frontier Finland, Tapani Tarvainen. ""The filter has blocked a search engine, a Japanese doll shop, a Thai chat room, and other perfectly innocent sites."" But police say that's just not possible. They argue that they review all the websites, and only block criminal material. According to police, the censorship list is necessary, because pornographic photos circulating on the net can cause never-ending trauma for victims. Nonetheless, some 20 complaints have already been filed against the police censorship action."
14.3.2008,Art Work Leads To Child Pornography Charges,http://yle.fi/uutiset/5827037,"
Finnish artist Ulla Karttunen is being charged with possession and distribution of child pornography, following the exhibition of a work intended as criticism of the exploitation of children.
 The prosecutor in the case is asking the court to only fine Karttunen in the case. He has said that consideration has been given to the fact that the artist intended the work as a statement opposing child pornography. The more serious charge of the distribution of child pornography stems from a brochure for an exhibition of Karttunen's art which contained a photograph of the art work which included pornographic images of children. The case will be heard by a court sometime this spring. In a work entitled ""Neitsythuorakirkko"" (Viginwhorechurch) exhibited at Helsinki's Kluuvi gallery, Karttunen used child pornography materials downloaded from the Internet. Police confiscated the work after a visitor to the gallery filed a complaint. Karttunen's computer was also seized. According to the artist, the work reveals how easily child pornography is available on the Internet. She says that she is astounded that the police would interfere with criticism of the problem while the problem itself remains unsolved."
18.6.2009,Police Bust 20 Finnish Suspects in Child Porn Raid,http://yle.fi/uutiset/5269853,"Finnish police detained persons suspected of possessing and distributing photos and films of sexual assaults against children. Finnish police confiscated more than 50 personal computers as well as a large number of external hard drives, memory sticks, CDs and DVDs. The majority of those detained have confessed to downloading child pornography through file-sharing sites. Police freed the suspects after questioning them. All in all, Nordic police raided the homes of 81 people suspected of downloading and spreading child pornography on the internet. 
Joint Police Raid Busts Child Porn Distributors
"
3.5.2018,Supreme Court denies appeal in sexual abuse of 10-year-old,https://yle.fi/uutiset/10188676,"The Supreme Court has rejected the prosecution’s request to appeal a three-year prison sentence handed down by a Pirkanmaa court for sexual crimes committed against a 10-year-old girl in autumn 2016. The case attracted a great deal of attention because both the local district court and the court of appeal decided against handing down a verdict for aggravated rape. The prosecution sought leave to appeal the verdict. It wanted a harsher conviction for the defendant – a 23-year-old asylum seeker – on the grounds of aggravated rape as well as the original verdict of aggravated sexual abuse. The prosecution also sought harsher sentencing for the man as well as heavier damages for the victim. However the Supreme Court refused leave to appeal the conviction and sentence, leaving the original appeal court sentence unchanged. The Pirkanmaa District Court and the Turku Appeal Court both convicted the man of aggravated sexual abuse of a minor and sentenced him to a three-year custodial sentence. Both courts found that the man had had sexual intercourse with the child and had performed sexual acts with her by sending messages about sexual matters. Both courts threw out charges brought against the man for aggravated rape. The courts ruled that there was no evidence to indicate that the sexual encounter involved violence or that the child was overcome by fear or incapacitated in any other way. At the time of the incident the victim was 10 and the defendant was 20 years old. The sexual abuse took place in a small town in the Pirkanmaa region, near Tampere. The court judgments sparked spirited national debate last autumn. Legal scholars expressed bewilderment over the finding that the act was not against the victim’s will and did not involve violence. For example, Turku University’s Jussi Tapani and Matti Tolvanen of the University of Eastern Finland, both professors of criminal law, examined the jurisprudence involved in the case in the daily Helsingin Sanomat. Tuula Tamminen, Professor of Child Psychiatry at the University of Tampere, said she was perplexed by the courts’ rulings, telling the daily Aamulehti that there is no way that a child could know what might be happening in such a situation. In November, Yle asked members of Parliament’s Law Committee if the case warranted changes to the legal code. At the time, committee chair and National Coalition Party MP Kari Tolvanen said he supported a longer sentence for such offences. He said that the section of criminal law dealing with aggravated sexual abuse of a child should be amended. ”The amendment would introduce harsher sentences for serious sexual offences against children overall. In my view that is fully justified, for example in light of a child’s vulnerability, even if the act does not meet the threshold for rape,” Tolvanen commented. Earlier this year, Justice Minister Antti Häkkänen called for tougher laws for sex offences against children."
5.12.2018,Police warn of online predators as suspected sex abuse cases uncovered in Oulu,https://yle.fi/uutiset/10540902,"The Oulu police department is advising young girls and their parents to be on the lookout for sexual predators active on social media. According to police, foreign-background men with poor Finnish-language skills have tried to make online contact with ""significantly younger"" underaged girls in the Oulu area. Some of these contacts have led to suspicion of aggravated sexual abuse, the police said.  The Oulu police said it has recently been informed of dozens of cases where adult men try to lure young girls online. ""That's the reason for our warning,"" said Detective Superintendent Markus Kiiskinen.  However, the warning mostly applies to one group of online predators and hopefully will not tarnish the reputation of all migrants, police added. ""I hope this will not result in more racism. The police would like to emphasise that not all people with foreign backgrounds are dishonest or criminals,"" Kiiskinen said.  The police also said parents should take an interest in who their child spends time with both online and offline.  Police are currently investigating three separate cases where migrant men are suspected of sexually abusing children in Oulu.  In one case, a group of men is suspected of sexually exploiting a girl between 10-14 years for a period of several months. The abuse took place in private residences in Oulu. Seven men have been arrested for assault, aggravated sexual abuse of a child and aggravated rape, however no charges have yet been laid. The two other cases occurred during one day and took place outdoors in the Tuira neighbourhood of Oulu. The victims were also under 15 years of age, police said. These cases are being investigated as sexual abuse of a minor, and aggravated sexual abuse and rape of a child, respectively. Police have released the suspect in the first case, but continue to hold the other suspect in custody.  All suspects had arrived in Finland as refugees or asylum seekers, police indicated. Some are Finnish citizens and some have been granted refugee status, while the rest are awaiting asylum decisions. The suspects come from four different countries and are between 20 and 30 years of age, with the exception of one who is over 30. In reaction to the news, Interior Minister Kai Mykkänen told tabloid Iltalehti that the criteria for granting Finnish citizenship should be tightened."
5.9.2008,Brax Pledges to Criminalise Internet Enticement of Minors,http://yle.fi/uutiset/5851159,"Justice Minister Tuija Brax has promised to introduce legislation next year that would criminalise ""grooming"" or sexual enticement of children over the Internet. Brax intends to set up a team of experienced officials from the Justice Ministry to develop a bill that could also be implemented in practice. Similar legislation rolled out in Norway has not proven to be effective. In an interview in the Swedish language daily Hufvudstadsbladet Brax said it is difficult to prove paedophiliac intentions. And she pointed out that legislation cannot be used to solve all problems. 
YLE
"
21.3.2019,"Finnish kids victims of human trafficking, study finds",https://yle.fi/uutiset/10700307,"A new report finds that youths in Finland have been forced into prostitution, and that the sugar dating phenomenon is putting teens at risk. The study was conducted by Elina Kervinen and Natalia Ollus of the European Institute group for Crime Prevention and Control, a UN-affiliated group.  “Human trafficking isn’t visible on the surface,” said Veikko Mäkelä, project manager for the Finnish National Assistance System for Victims of Human Trafficking, an Interior Ministry group which commissioned the report. Police and social workers don’t always realise that human trafficking underlies some cases of sexual abuse or that a teen caught stealing is working for someone else.  Mäkelä and Kervinen both asserted that sugar dating, which most often involves an older man bestowing gifts on a younger woman, sometimes in exchange for sexual favours, puts teens at risk for trafficking. Children taken into state custody or runaways are most vulnerable to traffickers. Drug-addicted youths forced to pay off their debts through prostitution are another at-risk group as are young foreign women sold into marriage with immigrant-background men in Finland. Mäkelä underscores that traffickers are often people close to children – parents, teachers, relatives or friends – individuals that can manipulate a child’s trust. Since becoming a punishable offence in 2004, Finnish courts have handed down six rulings on child trafficking. Five of the six cases involved native Finnish children. One of the cases involved a middle-aged man prostituting a 14-year-old girl after he convinced her to live with him. Another case centred on a drug ring holding an 18-year-old woman captive while prostituting her. Since 2007, the Finnish National Assistance System for Victims of Human Trafficking has dealt with some 200 human trafficking cases involving minors and people under 21.  However Kervinen, who co-authored the report issued on Thursday, said many more victims need help.  Most victims coming through the national assistance system are asylum-seekers, according to Mäkelä.  The report showed that it was easier for authorities to detect human trafficking abuses among asylum-seekers than the native population. Some young asylum-seekers have been sexually abused in their countries of origin, en route to Europe as well as in Finland, according to Mäkelä."
28 4 2020,Police investigate Helsinki child abuse case,https://yle.fi/uutiset/11326815,"Police in Helsinki are investigating the suspected abuse and neglect of a small child in Helsinki.  The suspected crimes came to light just under two weeks ago when police entered an apartment in the Meri-Rastila district of eastern Helsinki and found the child’s mouth had been taped over with a soothing dummy. Authorities are also investigating whether the child had alcohol or drugs in their bloodstream.  ""What happened is being investigated at this stage as assault and neglect,"" Detective Chief Inspector Jutta Antikainen of the Helsinki Police Department said. ""The investigation is ongoing and police are currently waiting for a medical report, among other things.""  Helsingin Sanomat reported on Tuesday that police were responding to a complaint when they entered the apartment, and that the child’s welfare had been previously brought to the attention of child welfare services.  Police were unwilling to comment further on the case, declining to confirm if any action has previously been taken by child protection authorities or other authorities in regard to the child, citing the need to protect the identity of the victim of a suspected crime.  ""The most important thing is that the matter has been brought to the attention of the authorities. We urge anyone who is concerned about the well-being of a loved one, especially a child, to contact the authorities,"" Antikainen added.  Teachers and daycare staff are often the ones to raise issues with social services if they suspect abuse, but many children are not attending daycare centres or schools due to restrictions brought about by the coronavirus pandemic. Authorities have reported seeing a decrease in the number of child protection notifications received in recent weeks, with police opening about 50-100 fewer investigations per week involving crimes against children than at the same time last year. ""The biggest concern is with children whose distress is not being seen,"" social worker Sonja Soini from Save the Children told Helsingin Sanomat. This concern prompted police to remind the public that everyone has a responsibility to act if they suspect a crimes such as the neglect of or violence against children. “In acute situations, notifications should be made to the emergency number 112. It is also worth making a child protection notification at the stage where there is concern about the family's situation” Antikainen said."
24 6 2020,Man sentenced to 5 years in prison for sexual abuse of children,https://yle.fi/uutiset/11416587,"A district court in south west Finland has found a man guilty on multiple charges of sexual offenses against children and sentenced him to five years in prison.  The defendant had faced charges including aggravated sexual abuse of a child, aggravated child rape, and the possession and dissemination of indecent images of children. The victims were from different parts of Finland. One charge of aggravated sexual abuse involved a child born in 2017, who was indecently assaulted and photographed by the defendant. The prosecutor had demanded that the charge of aggravated rape of this child be added to the case, but the court dismissed this due to a lack of evidence. The man had used a number of different social media channels, including Instagram, to 'groom' children aged between nine and 13. Once he initiated contact with his victims, he turned the conversation to matters of a sexual nature, such as requesting them to send nude photos.  The court also heard that the defendant had sent photos of his own genitals to a number of the victims.  The crimes took place between 2019 and 2020, and were brought to the attention of Finnish police through tip-offs from both domestic and international sources. The court also ordered the defendant to pay a total of 35,000 euros compensation to the victims.  The decision of the district court is not final, leaving the man an opportunity to appeal. "
