Date,Title,Article_Link,Article
25.10.2007,"Internet Child ""Grooming"" to be Made Illegal?",http://yle.fi/uutiset/5807652,"Among the provisions of the agreement is a commitment by signatories to implement legislation prohibiting the sexual enticement of minors over the internet. The common agreement contains a wide range of measures aimed at protecting children from sexual abuse. Considerations of crime prevention, victim protection and assistance have all been taken into account. Further measures are also included such as a commitment to criminalise so called ""grooming"", where a child in misled into a meeting for the purposes of sexual abuse or participation in child pornography. Finnish legislation currently puts the legal limit on sexual abuse at 16 years of age and of participation in pornography at 18 years. The new agreement will require changes to current national legislation. 
YLE
"
4.3.2008,Demonstration Against Internet Censorship,http://yle.fi/uutiset/5826087,"
A demonstration against preventative Internet censorship was held in downtown Helsinki on Tuesday. Demonstrators protested a National Bureau of Investigation list aimed primarily at blocking access to child pornography websites.
 The demonstration was organised by a network of citizens opposed to a law, in force since last year, allowing police to recommend to Internet operators to block access to websites containing child pornography. Compliance with the recommendation is voluntary. Protestors are concerned that other types of sites will be included on the police list and argue that present filtering does not prevent child abuse or the spread of child pornography. The groups behind the demonstration say that the law gives police authorities unreasonable powers that they should not have without court supervision. They also say that as the lists are not published, the secrecy of the censorship process is also contrary to the ideal of government transparency. Demonstrators called for an end to the filtering of Internet traffic, and in its place, concrete measures by police to close down websites containing child pornography. Organizers claim that the police have abused their authority by censoring sites that do not contain child pornography, including a Finnish site criticizing this specific implementation of censorship. The National Bureau of Investigation has conceded that some sites that do not contain child pornography may have been put on the block list. The most recent debate around the issues of child pornography and freedom of speech has also aroused concern at the Ministry of Communications. Last month Communications Minister Suvi Lindén set up a working group to look at how children and teens can be shielded from harmful content on the Internet and in other electronic media. YLE"
11.2.2008,Medical Treatment for Sex Offenders?,http://yle.fi/uutiset/5822937,"A working group at the Ministry of Justice is looking into whether medical treatment is an option that will enable sex offenders to serve their sentences outside of prison. Treatment would be available for those serving conditional prison sentences as well as to prisoners under conditional release. The proposed treatment would aim to block the urges that drive offenders to commit new acts of sexual violence. Drugs geared towards sex offenders are now considered to be more effective than before and also carry fewer side effects. The working group has until the end of November to make a recommendation. Meanwhile, the National Research Institute of Legal Policy has launched an investigation into the sentencing grounds in child abuse cases."
29.5.2020,No rise in child welfare reports after schools re-open,https://yle.fi/uutiset/11376025,"The number of child welfare reports filed with child protection authorities did not increase when schools re-opened following about two months of distance learning, according to an Yle investigation. Officials had previously expressed concern that a decline in welfare reports during the spring when children were learning at home meant that cases of neglect or abuse might have been overlooked. They speculated at the time that the reduced number of reports was due to the fact that in many cases, reports are filed by school or daycare officials. But according to Yle’s review of data there has so far been no increase in reports during the last two weeks of the school year when pupils returned to class. Yle checked social workers’ figures on child welfare reports in large cities such as Helsinki, Espoo, Vantaa, Turku, Tampere and Oulu. Only Tampere showed no change in reports during the pandemic. However in the other large cities, the data showed a sharp fall in the number of complaints at the start of the partial state of emergency, when schools closed to help curb the spread of coronavirus. In Turku, for example, the number of child welfare reports fell by 25 percent in April compared to the same time last year, while the corresponding amount in Espoo was more than 30 percent. After the initial steep drop, the number of notifications began to climb slowly, but in many cities it is still at their usual low level. Helsinki child welfare social work head Jonna Vanhanen said that during May there was an exceptionally low number of reports about children in distress. She noted that typically, reports begin to rise in May as the academic year comes to an end. ""Since the beginning of the state of emergency, there have been few child welfare complaints compared to the past. When school starts there are usually somewhat more [reports] compared to the beginning of May, for example, but the difference is considerable compared to last year,"" she added. In Helsinki, the reduced number of notifications are visible, especially in reports concerning violence towards children, children’s psychological problems, substance abuse and offences committed by minors. Authorities believe that a lower number of child welfare reports is bad news because it suggests that problems have gone underground. In recent years, the trend has been for such complaints to grow steadily from year to year. ""This is a worrying phenomenon. Apparently we now have a lot of invisible distress that is not coming to anyone’s attention,"" Children’s Ombudsman Elina Pakkarinen said. She pointed out that in addition to distance learning, the lives of children and teens had also been affected by a lack of other services and adult contact. Counselling visits had fallen and youth outreach work could no longer take place face to face. ""On top of that many children may have parents with substance abuse or mental health problems. If they don’t use [social] services, their children’s distress and need for support will not be visible,"" she added. Hanna Heinonen, chief executive of the Central Union for Child Welfare, said that she was worried about whether or not children in need of assistance and support had been overlooked during the spring when kids were not at school. ""The coronavirus situation has especially affected families that struggled with everyday life, even before the state of emergency. There’s a concern whether or not this has created a pent-up need for services,"" Heinonen said. For schools, a child welfare report is a last resort for addressing children’s problems. As a result, the real need for child protection services is usually only known after school vacations. ""It’s foreseeable that after the holiday there will be a situation where many children and families will need support to deal with everyday life,"" Heinonen said. Officials in Vantaa are preparing for a larger than usual demand for youth support services in particular during the summer, according to family services director Anna Cantell-Forsbom. The number of child welfare notifications in Vantaa, fell markedly to a lower-than-normal level when schools closed because of the crisis, but rebounded to closer to the levels seen last year during April. ""During the coronavirus situation Vantaa’s social and crisis unit has recorded cases of family violence and increased alcohol consumption by parents and this has resulted in more emergency visits than usual,"" Cantell-Forsbom added. According to Children’s Ombudsman Pakkarinen now is the time to focus on offering assistance as early as possible so that family problems do not escalate. ""We should especially place emphasis on vulnerable children and young people and make sure that their need for support does not become so great that they have to turn to child protection services, for example,"" she declared. Politicians have also expressed concern over the impact of the crisis on children. Government is expected to include a support package for children and young adults in its supplemental budget next week. The funding will aim to address any disadvantages caused by the long period of distance learning. The Ministry of Social Affairs and Health has also created a working group charged with strengthening children’s rights and to support after-care for children and families following the crisis. The working group is due to wrap up its work at the end of October."
19.10.2008,Police Continue Intensified Internet Watch,http://yle.fi/uutiset/6115694,"
Intensified monitoring of the internet by The National Bureau of Investigation is to continue until the end of this month. Police have followed up hundreds of leads relating to threats despite the lack of additional resources.
 Police have kept a watchful eye on the internet for almost a month since the Kauhajoki shooting. They have examined hate and racist sites in addition to searching for suspicious profiles. Tip offs from other police officers, webmasters and internet users have also greatly assisted their investigations. All tip offs relating to threats on individuals or crime have been followed up but police describe the job of searching for deranged individuals as looking for a needle in a haystack. In addition to two fulltime officers to oversee the internet investigations, five other policemen have been brought in. However, no extra police have been recruited. A decision will be made at the end of the month whether to continue the current level of investigations. Interior Minister Anne Holmlund believes the investigation must continue and has promised additional financial and human resources for the police next year. For their part, police say the current intensified internet operation is affecting other investigations such as tracing pedophiles. A dedicated internet investigation unit would be most welcome, they say. So far, though, no decision has been made by the Interior Ministry. YLE"
21.8.2019,Up to €1m for schools to combat online child predation,https://yle.fi/uutiset/10931344,"The Ministry of Education and Culture has launched a special funding programme to help protect young people against online predators. The initiative will see the ministry provide up to one million euros for primary and pre-schools for media literacy training for their youngsters. The ministry said that it hopes the funding will be used to support programmes that train children to operate safely and prudently online, and specifically to examine the terms of use and privacy settings of different services.  ""Online predation and abuse is a worrying trend that must be fought decisively. It is the responsibility of us adults to offer children and young adults enough support and information so they can operate safely in social media and elsewhere online,"" Education Minister Li Andersson said in a statement. Schools can use the funding for purposes such as hiring teachers, teaching assistants and counsellors. At the end of 2018, police in Oulu had warned of online predators follow reports of a series of child sexual abuse allegations."
29.7.2019,Helsinki man held on suspicion of multiple child sex offences,https://yle.fi/uutiset/10897500,"Police in Helsinki have arrested a man they suspect of committing multiple sex offences against at least twelve underage girls.  Investigators believe that there may be more victims of the man known as ""Eno"" or Uncle, and have released an image of the suspect with a request for further victims and witnesses to come forward. The police justify their decision to publish the suspect's photograph on the grounds that it is necessary in order to carry out a full investigation into the man's possible crimes.  Although he is only suspected of the crimes at this stage, public broadcaster Yle is also publishing the image of the man, due to these exceptional circumstances.  Director of the investigation Saara Asmundela of the Helsinki Police Department said that the identity of at least one of the suspected victims has not yet been established. ""It may be that some of the victims are not even aware that they were abused because many of the victims known to the police were in an unconscious state at the time the suspected offences occurred. This was due to the suspect supplying the victims with alcohol or other intoxicants,"" she said.  The man is suspected of, among other things, multiple cases of aggravated rape and aggravated sexual abuse of a child. The offences are believed to have occurred at the man's apartment in the Helsinki neighbourhood of Laajasalo, beginning in 2006 and continuing over the course of several years.  According to police, the suspect is known as ""Eno"" by the young people in his local community. During their preliminary investigation, police have discovered that the suspect had also been known to offer alcohol and narcotic drugs to minors.  Police have emphasised that they believe a number of serious crimes have transpired, and that the evidence provided by both victims and witnesses will play an important role in determining possible charges. ""We ask that anyone who suspects that they have been the victim of a crime or knows something that might be helpful in the investigation to please contact us,"" Asmundela said.  Police request contacts use the e-mail address sexualcrime.helsinki@poliisi.fi.  
 "
14.12.2018,18-month suspended jail term for Helsinki teacher over students' sexual abuse,https://yle.fi/uutiset/10555426,"A teacher at a Swedish-language school in Helsinki was slapped with an 18-month suspended prison sentence for the sexual abuse of students in his charge. The court also ordered the defendant to pay damages amounting to 1,500 euros to one of the complainants and 1,200 euros each to four others. The court found that the offences occurred between 2013 and 2017. The 43 year-old denied the charges in court and said that when he touched the children he was providing massages and other forms of assistance without any sexual intent. The court ruled that the teacher had sent messages with sexual images and texts to young boys, which prompted a written warning in 2014. However he continued to engage in inappropriate communications with the students in spite of the warning, the court said. The school filed a criminal report about the teacher at the beginning of 2017. The school principal was also charged with dereliction of duty in connection with the teacher's offences. The court will hear the case against the principal in 2019. Svenska Yle reported on Friday that the teacher had not been teaching since April 2017, when police began to investigate the suspected offences."
25.5.2020,Fourth human trafficking suspect in theatre predator case,https://yle.fi/uutiset/11366715,"Helsinki police say they have identified a fourth suspect in their investigation of a human trafficking and sexual offences case involving well-known theatre influencer Veijo Baltzar.  In a statement issued on Monday, police said that the new suspect is believed to have committed human trafficking. Only one of the four people suspected in the cases has been remanded into pre-trial custody. The main suspect in the group of alleged offences is cultural luminary Veijo Baltzar. He is suspected of committing several counts of aggravated rape and aggravated human trafficking between 2016 and 2019. The allegations were first reported in November last year. The sexual offences allegedly took place in Helsinki, Kuopio, Rautalampi in northern Savo and Tammisaari, which lies in Raseborg (Raasepori in Finnish) in southwest Finland. Baltzar is also suspected of child sexual abuse, sexual abuse and assault. Police said that they would not comment further on the investigation at this stage and indicated that the deadline for pressing charges is 18 November.  Last November, daily Helsingin Sanomat reported that 77-year-old Baltzar had manipulated, controlled and preyed on girls and young women in his theatre company.  The paper interviewed 18 women and girls who said they had personal experience working with the globally-renowned figure. Many said they felt that in rehearsals they had to please Baltzar if they wanted to gain his approval or land an important role.  The interviewees said that Baltzar lured young women to stay at his home. He was said to have been living in Tammisaari and Rautalampi at the time. HS also reported that he insisted that the girls break with their families and boyfriends.  Baltzar has denied the allegations of aggravated human trafficking. He was remanded into custody last November. At the time, police suspected two other individuals of aggravated human trafficking. Charges were initially to be laid against him in February, but the deadline was first extended until June and later until November as new developments emerged in the case."
22.11.2017,"Wednesday's papers: Rape acquittal, status of Swedish and a transgender baseball star",https://yle.fi/uutiset/9942440,"Several media report on the appeal of a 23-year-old asylum seeker convicted of the sexual abuse of a 10-year-old girl. The man was sentenced to three years in jail for aggravated sexual abuse, but acquitted of rape in a verdict that prompted extensive debate on social media. The court ruled that the man had sex with the girl in a deserted courtyard of an apartment building in Pirkanmaa, and that constituted aggravated sexual abuse, but acquitted him of rape because the court ruled there was not adequate evidence the girl was afraid or helpless. Aamulehti reported on the case on Tuesday with a look at the nuts and bolts of the rape law that underpinned the verdict. That law holds that for a rape conviction to stand either violence or the threat of violence should be used; or the victim should be unable to defend themselves or articulate their rejection of the attacker. Needless to say, the court's view that a 10-year-old did not meet these criteria has raised eyebrows. ""If this situation doesn't have the essential elements of a rape offence, then yes we should consider changing the law,"" said Professor of Criminal Law Matti Tolvanen in comments to Aamulehti that were widely reported in other media. Yle's Finnish-language service reported the appeal court's verdict last Friday. A broad survey on attitudes towards the Swedish language makes the news today, with Helsingin Sanomat reporting that ""The position of Swedish isn't important to the young"". That refers to a finding that just 52 percent of those questioned aged under 30 regarded the position of Swedish in Finnish society as important. That percentage rises to 80 percent among pensioners. The older the respondent, the the stronger the desire to protect the status of Swedish. Good Swedish skills were regarded as important in decision-makers by just 60 percent of respondents, down from 80 percent in the same survet in 2008. Half of respondents said they had no use for Swedish skills, while nearly half of Finnish speakers questioned said that public services in Swedish cost the taxpayer too much money. Iltalehti reports on the first transgender Finnish baseball player to come out in Finland. Alexander Saloranta announced last week that he wants to live as a man. He has five baseball championships to his name, was voted player of the year in 2011 and plays for the Lapua team in a rural part of South Ostrobothnia. The news came as a surprise to those who knew him as Paula, his birth name, but the 30-year-old was now ready to go public. Saloranta says he always knew he wanted to be a boy, even as a small child. His fiance Sari and his parents have been supportive, and even as Paula, Saloranta was one of the few openly LGBT sports stars in Finland. Now his career in the women's leagues is over, as hormones will show in doping tests and result in a ban from playing. He says he won't seek a men's team to play for, but if one asks, he might well give it a try."
16.2.2019,Added funds for elder care and sex crime prevention top supplementary budget proposal,https://yle.fi/uutiset/10649885,"The Finnish Finance Ministry published its first proposal for supplementary allocations to the 2019 budget on Friday, 15 February. Government will first approve or reject the suggested injections of additional money, after which a version of the proposal is expected be presented to Parliament next week. Recent police suspicions of shocking events in the northwest city of Oulu and reports of gross neglect in some privately-run senior care facilities have led to a ministry call for five million more euros to be directed towards the prevention of sex crimes, and an allocation for the hiring of more inspection personnel on the regional and state level to oversee services catering to the elderly, disabled and early childhood education. The added five million euros to prevent sex crimes targeting children and youth includes 1.6 million euros more for online policing and 1.5 million euros for relevant educational work in schools. The ministry proposes an additional 0.3 million euros be granted to youth work, and 800,000 more euros devoted to the launch of a new LASTA model, a new child protection service structure consisting of 18 regional hubs of specialist social service and health care. The new structure aims to provide child friendly investigation and support for all cases of alleged physical or sexual abuse. The ministry would also award 4.8 million euros in added funding to the Finnish Immigration Service (Migri) for immigration-related security measures. The proposal says the additional funding would be used to improve Migri activities and found a new detention facility in Oulu. Among other technical adjustments, the first supplementary budget proposal of 2019 also revises down its tax revenue estimate to reach a figure 196 million euros lower than was originally forecast. In this latest iteration of the Finnish budget for 2019, expenditure estimates increased by 80 million euros, while revenue estimates were reduced by 190 million, meaning that the proposal increases the government's net borrowing requirement by 270 million euros. "
